Cliente;Arquivo;Código;Descrição;Peso;Valor;NCM
05-03-2026 - 25-608_ESTUDO_250503 - COM LI ANP;05-03-2026 - 25-608_ESTUDO_250503 - COM LI ANP.xlsx;2026-04-02 18:45:43;5264;1;1;WQ001;6000;PC;USD;0.15;=F3*I3;ESPUMA EXPANSIVA PU 320G/500ML Dimensões da Peça: 6,5 x 6,5 x 20,5cm Espessura: Capacidade: Dimensões da Embalagem: N/A Tipo de Embalagem: ETIQUETA ,COLMÉIA Quantidade Inner: N/A Dimensões Inner: x x Quantidade Master: 12 Peças Dimensões Master: 27 x 20 x 25cm Material: Mdi, éter dimetil, poliol, propetano/isobutano Cor: Frasco colorido Marca: WESTERN Origem: CHINA Composição do Produto: 1 unidade Caracteristicas Importantes: • Vedação- • Preenchimento- • Aderência- • Resistência- • Isolamento Térmico- • Isolamento Acústico- • Versatilidade- • Fácil Aplicação- • Secagem Rápida- • Durabilidade. - Especificações Técnicas: • Capacidade: 320g/500ml- • Material: PU (Poliuretano)- • Aparência (visual): Líquido comprimido levemente amarelado- • Odor: Baixo odor- • Consistência: Espuma estável- • Secagem ao toque: 7 a 15 minutos- • Cura inicial: 30 minutos- • Cura total: 24 horas- • Temperatura de aplicação: 5 a 45 °C- • Rendimento (Litros): 230g (12 Litros) / 360g (18 Litros). Instruções de Uso: 1. Não pode ser utilizada para montagem estrutural- 2. Para superfícies onde há contato direto com alimentos- 3. Áreas em imersão de água constante- 4. Não utilizar para envidraçamento estrutural- 5. Articulações onde a abrasão e abuso físico são constantes- 6. Não vai aderir a alguns plásticos, como o polietileno, polipropileno e Teflon. 7. Incompatível com cola de contato à base de solvente. Antes do Uso: Verificar se o produto está em perfeitas condições de uso ou instalação Perigos: Cuidado durante o manuseio do produto para evitar acidentes Cuidados: Utilize o equipamento de proteção individual necessário ao trabalho (óculos de proteção, luvas, botas etc.) Advertencia/ Atenção: • Manter fora do alcance das crianças- • Trabalhe seguro. Indicação: Ideal para vedação e preenchimento em diversos tipos de superfícies. Com sua fórmula de alta qualidade, oferece aderência superior e resistência às intempéries. Ideal para aplicações em construção civil, manutenção e reparos, esta espuma proporciona isolamento térmico e acústico eficaz. Sac Fornecedor: Sac: 0800 607 1322 - Email: posvendas@etilux.com.br - Site: www.etilux.com.br Garantia: Em condições normais de uso, este produto tem garantia de 90 dias contra defeitos de material e fabricação, mediante apresentação da nota fiscal de compra. Má conservação, manuseio inadequado, quedas ou quaisquer outras avarias produzidas pelo uso incorreto, a garantia oferecida perde a validade.;WESTERN;0;12;500;1877.9999999999998;2900;0;0.41;5.556;5.8;F12860 - 01 - LINYI HAOYI TRADING CP. LTD;XINYUAN ROAD WITH HENGTONG ROAD,TANCHENG INDUSTRY PARK,LINYI CITY,SHANDONG PROVINCE,CHIAN;;7897186095127;;57897186095122;27;20;25;6.75;39095019;=J3/P3;SEM LI;NCM OK;REPOSIÇÃO
05-03-2026 - 25-608_ESTUDO_250503 - COM LI ANP;05-03-2026 - 25-608_ESTUDO_250503 - COM LI ANP.xlsx;2026-04-02 18:45:43;5264;1;2;WQ004;6000;PC;USD;0.09;=F4*I4;SILICONE SPRAY LUBRIFICANTE 400ML Dimensões da Peça: 6,5 x 6,5 x 15,8cm Espessura: Capacidade: Dimensões da Embalagem: N/A Tipo de Embalagem: ETIQUETA ,COLMÉIA Quantidade Inner: N/A Dimensões Inner: x x Quantidade Master: 12 Peças Dimensões Master: 27 x 20 x 21cm Material: Diclorometano, éter dimetil, petróleo de hidrogênio, óleo de silicone. Cor: Frasco colorido Marca: WESTERN Origem: CHINA Composição do Produto: 1 unidade Caracteristicas Importantes: • Protege, renova e dar brilho- • Alta proteção- • Impermeabiliza- • Seguro para uso em borrachas, vinil e plástico. Instruções de Uso: N/A Antes do Uso: Verificar se o produto está em perfeitas condições de uso ou instalação Perigos: Cuidado durante o manuseio do produto para evitar acidentes Cuidados: • Possui propriedades lubrificantes e protetivas de alta qualidade- • Lubrifica com segurança, impermeabiliza e protege superfícies metálicas e não metálicas, incluindo borracha, plástico e vinil- • Seca rápido sem deixar manchas, forma um filme claro protetor que não se torna pegajoso, por isso não atrai a sujeira. Advertencia/ Atenção: Manter fora do alcance das crianças, Trabalhe seguro Indicação: • Recomendado para painéis de veículos, canaletas de vidros, peças de vinil, couro, borrachas, ferramentas, maçaneta, coifas e batentes de amortecedores, rodas e pneus, borrachas de portas e selos de teto solar, trilhos, corrediças, cadeados, roldanas, esteiras, aparelhos de ginastica, eletrodomésticos, matrizes de corte, lâminas, serras e desmoldagens. Sac Fornecedor: Sac: 0800 607 1322 - Email: posvendas@etilux.com.br - Site: www.etilux.com.br Garantia: Em condições normais de uso, este produto tem garantia de 90 dias contra defeitos de material e fabricação, mediante apresentação da nota fiscal de compra. Má conservação, manuseio inadequado, quedas ou quaisquer outras avarias produzidas pelo uso incorreto, a garantia oferecida perde a validade.;WESTERN;0;12;500;822;1570;0;0.24;2.94;3.14;F12860 - 01 - LINYI HAOYI TRADING CP. LTD;XINYUAN ROAD WITH HENGTONG ROAD,TANCHENG INDUSTRY PARK,LINYI CITY,SHANDONG PROVINCE,CHIAN;;7897186095103;;57897186095108;27;20;21;5.67;39100012;=J4/P4;SEM LI;NCM OK;REPOSIÇÃO
05-03-2026 - 25-608_ESTUDO_250503 - COM LI ANP;05-03-2026 - 25-608_ESTUDO_250503 - COM LI ANP.xlsx;2026-04-02 18:45:43;5264;1;3;WQ040;10008;PC;USD;0.06;=F5*I5;DESENGRIPANTE 300ML/170G INCOL Dimensões da Peça: 5 x 5 x 16 cm Espessura: Capacidade: 300 ml Dimensões da Embalagem: N/A Tipo de Embalagem: ETIQUETA Quantidade Master: 12 Peças Dimensões Master: 21,3 x 20,1 x 16,3 cm Material: Diclorometano, Querosene, Óleo Mineral, GLP, Ferro Cor: Incolor Marca: WESTERN Origem: CHINA Composição do Produto: 1 unidade Características Importantes: • Penetra e desengripa- • Limpa e lubrifica- • Evita corrosão- • Elimina rangido- • Protege contra umidade. Instruções de Uso: • Agite bem antes de usar. Pulverize nas áreas desejadas a uma distância de aproximadamente 20 cm. Para lugares de difícil acesso, utilize o bico aplicador preso à tampa da embalagem. Antes do Uso: Verificar se o produto está em perfeitas condições de uso ou instalação Perigos: Cuidado durante o manuseio do produto para evitar acidentes Cuidados: PRECAUÇÕES: • Utilize o desengripante em uma área bem ventilada para evitar a inalação de vapores. Se possível, faça o procedimento ao ar livre- • Use luvas e óculos de proteção para evitar contato direto com o produto químico, podendo causar irritações na pele e nos olhos. Em caso de contato, lave a área afetada com bastante água limpa em abundância- • Não expor a temperatura superior a 40 °C- • Não deixar próximo ao motor e não armazenar no interior do veículo- • Armazenar em local fresco e seco, longe de fontes de calor, umidade, faíscas e chamas. Manter fora do alcance de crianças e animais de estimação- • Nunca perfure ou incinere a lata, mesmo que esteja vazia. O conteúdo sob pressão pode ser perigoso- • Descarte a lata vazia de acordo com as regulamentações locais de reciclagem ou coleta de resíduos perigosos. Não jogue no lixo comum. Advertência/Atenção: Manter fora do alcance das crianças. Trabalhe seguro. Indicação: • Indicado para desengripar e lubrificar articulações, polias e engrenagens de máquinas industriais- • Lubrifica e protege contra o ressecamento de peças de bicicletas, barcos, residências e automóveis em geral- • Eliminador de ruídos de dobradiças de portas, fechaduras, trincos, rolamentos, entre outros. SAC Fornecedor: SAC: 0800 607 1322 Email: posvendas@etilux.com.br Site: www.etilux.com.br Garantia: Em condições normais de uso, este produto tem garantia de 90 dias contra defeitos de material e fabricação, mediante apresentação da nota fiscal de compra. Má conservação, manuseio inadequado, quedas ou quaisquer outras avarias produzidas pelo uso incorreto, a garantia oferecida perde a validade.;WESTERN;0;12;834;1286.742857142857;2578.728;0;3.056;2.892;3.092;SHANDONG SAIGAO NEW MATERIAL CO.,LTD;XINYUAN ROAD WITH HENGTONG ROAD,TANCHENG INDUSTRY PARK,LINYI CITY,SHANDONG PROVINCE,CHIAN;;7896673192103;17896673192100;57896673192108;21.3;20.1;16.3;5.8201;27101932;=J5/P5;COM LI - ANP;NOVO;SUGESTÃO
05-03-2026 - 25-608_ESTUDO_250503 - COM LI ANP;05-03-2026 - 25-608_ESTUDO_250503 - COM LI ANP.xlsx;2026-04-02 18:45:43;5264;1;4;WQ007;10008;PC;USD;0.09;=F6*I6;TINTA SPRAY USO GERAL BRILHO PRETO 400ML Dimensões da Peça: 6,5 x 6,5 x 15,8cm Espessura: Dimensões da Embalagem: N/A Tipo de Embalagem: ETIQUETA ,COLMÉIA Quantidade Inner: N/A Dimensões Inner: x x Quantidade Master: 12 Peças Dimensões Master: 26 x 20 x 20cm Material: Xileno, diclorometano, acetato de etila, ácido 2 propenóico, éter dimetil. Cor: Preto brilhante Marca: WESTERN Origem: CHINA Composição do Produto: 1 unidade Caracteristicas Importantes: • Secagem: 15 minutos ao toque, 1 hora para manuseio e 24 horas para teste de resistência- • Compacto- • Armazenamento menos de 40°C- • Capacidade: 400ml / 250g Instruções de Uso: Preparo da Superfície: • Deve-se limpar bem e lixar (se necessário) qualquer superfície a ser pintada, pois deverá estar seca e completamente livre de gordura, ferrugem, restos de pintura velha, pó, resina, etc. Proteja a parte que não será pintada. Aplicação: • Agite bem a lata antes usar, faça um pequeno teste do aplicador, pressionado a válvula algumas vezes em qualquer superfície, verificando o formato do jato- • Pulverize a uma distância de 10 cm do local, utilizando-se de movimentos uniformes cobrindo a área desejada. Instruções Específicas: • Aplicar de uma a duas demãos, aguarde secagem, lixe com lixa d’água 400 até a superfície ficar homogênea e lisa- • Para uma melhor cobertura, aplique várias de mãos com intervalos regulares entre as mesmas- • Em cores metálicas, exceto as cores cromada, ouro e dourada, aplicar duas de mãos de verniz. Antes do Uso: Verificar se o produto está em perfeitas condições de uso ou instalação Perigos: N/A Cuidados: Recomendações e Cuidados: • Não aplicar o verniz nas cores metálicas cromada, bronze, ouro e dourada e em superfícies de vinil, isopor, plástico, acrílico ou tecidos emborrachados- • Evite escorrimento, aplicando a primeira demão bem fina, como uma névoa, preparando a superfície para as próximas demãos- • Em plástico, acrílicos, madeira, papel, gesso, metal, couro, cerâmica, vime, fazer um teste em uma pequena área, para verificar a compatibilidade e secagem do produto. OBS.: Em superfície de madeira fazer um pequeno teste antes de aplicar para verificar secagem e resistência, pois ambas poderão ser alteradas- • Não aplicar em temperaturas abaixo de 18°C ou com tempo muito úmido- • Em dias de muito frio, recomenda-se deixar as peças a serem pintadas no sol, antes da pintura- • Não realizar a aplicação em locais fechados ou sem circulação de ar- • Após o uso, limpe a válvula, virando a lata para baixo, e pressionando até sair somente gás- • Em caso de entupimento da válvula, retire o atuador e mergulhe em acetona ou qualquer outro solvente- • Quando necessário, limpe o orifício com uma agulha bem fina. Advertencia/ Atenção: • Manter fora do alcance das crianças- • Trabalhe seguro. Indicação: • Indicada para diversos tipos de pintura, garantindo uma boa cobertura e acabamento, com alto rendimento e excelente secagem, com cores que proporcionam ótimo efeito decorativo. Para todos esses resultados aplique seguindo as instruções de uso. Sac Fornecedor: Sac: 0800 607 1322 - Email: posvendas@etilux.com.br - Site: www.etilux.com.br Garantia: Em condições normais de uso, este produto tem garantia de 90 dias contra defeitos de material e fabricação, mediante apresentação da nota fiscal de compra. Má conservação, manuseio inadequado, quedas ou quaisquer outras avarias produzidas pelo uso incorreto, a garantia oferecida perde a validade.;WESTERN;0;12;834;2471.9759999999997;3741.324;0;0.368;4.284;4.486;F12860 - 01 - LINYI HAOYI TRADING CP. LTD;XINYUAN ROAD WITH HENGTONG ROAD,TANCHENG INDUSTRY PARK,LINYI CITY,SHANDONG PROVINCE,CHIAN;;7897186095523;;57897186095528;26;20;20;8.6736;32082019;=J6/P6;SEM LI;NCM OK;REPOSIÇÃO
05-03-2026 - 25-608_ESTUDO_250503 - COM LI ANP;05-03-2026 - 25-608_ESTUDO_250503 - COM LI ANP.xlsx;2026-04-02 18:45:43;5264;1;5;WQ009;10008;PC;USD;0.09;=F7*I7;TINTA SPRAY USO GERAL BRILHO BRANCO 400ML Dimensões da Peça: 6,5 x 6,5 x 15,8cm Espessura: Capacidade: Dimensões da Embalagem: Tipo de Embalagem: ETIQUETA ,COLMÉIA Quantidade Inner: N/A Dimensões Inner: x x Quantidade Master: 12 Peças Dimensões Master: 26,3 x 19,9 x 20,7cm Material: Xileno, diclorometano, acetato de etila, ácido 2 propenóico, éter dimetil. Cor: Branco brilhante Marca: WESTERN Origem: CHINA Composição do Produto: 1 unidade Caracteristicas Importantes: • Secagem: 15 minutos ao toque, 1 hora para manuseio e 24 horas para teste de resistência- • Compacto- • Armazenamento menos de 40°C- • Capacidade: 400ml / 250g Instruções de Uso: Preparo da Superfície: • Deve-se limpar bem e lixar (se necessário) qualquer superfície a ser pintada, pois deverá estar seca e completamente livre de gordura, ferrugem, restos de pintura velha, pó, resina, etc. Proteja a parte que não será pintada. Aplicação: • Agite bem a lata antes usar, faça um pequeno teste do aplicador, pressionado a válvula algumas vezes em qualquer superfície, verificando o formato do jato- • Pulverize a uma distância de 10 cm do local, utilizando-se de movimentos uniformes cobrindo a área desejada. Instruções Específicas: • Aplicar de uma a duas demãos, aguarde secagem, lixe com lixa d’água 400 até a superfície ficar homogênea e lisa- • Para uma melhor cobertura, aplique várias demãos com intervalos regulares entre as mesmas- • Em cores metálicas, exceto as cores cromada, ouro e dourada, aplicar duas demãos de verniz. Antes do Uso: Verificar se o produto está em perfeitas condições de uso ou instalação Perigos: N/A Cuidados: Recomendações e Cuidados: • Não aplicar o verniz nas cores metálicas cromada, bronze, ouro e dourada e em superfícies de vinil, isopor, plástico, acrílico ou tecidos emborrachados- • Evite escorrimento, aplicando a primeira demão bem fina, como uma névoa, preparando a superfície para as próximas demãos- • Em plástico, acrílicos, madeira, papel, gesso, metal, couro, cerâmica, vime, fazer um teste em uma pequena área, para verificar a compatibilidade e secagem do produto. OBS.: Em superfície de madeira fazer um pequeno teste antes de aplicar para verificar secagem e resistência, pois ambas poderão ser alteradas- • Não aplicar em temperaturas abaixo de 18°C ou com tempo muito úmido- • Em dias de muito frio, recomenda-se deixar as peças a serem pintadas no sol, antes da pintura- • Não realizar a aplicação em locais fechados ou sem circulação de ar- • Após o uso, limpe a válvula, virando a lata para baixo, e pressionando até sair somente gás- • Em caso de entupimento da válvula, retire o atuador e mergulhe em acetona ou qualquer outro solvente- • Quando necessário, limpe o orifício com uma agulha bem fina. Advertencia/ Atenção: • Manter fora do alcance das crianças- • Trabalhe seguro. Indicação: • Indicada para diversos tipos de pintura, garantindo uma boa cobertura e acabamento, com alto rendimento e excelente secagem, com cores que proporcionam ótimo efeito decorativo. Para todos esses resultados aplique seguindo as instruções de uso. Sac Fornecedor: Sac: 0800 607 1322 - Email: posvendas@etilux.com.br - Site: www.etilux.com.br Garantia: Em condições normais de uso, este produto tem garantia de 90 dias contra defeitos de material e fabricação, mediante apresentação da nota fiscal de compra. Má conservação, manuseio inadequado, quedas ou quaisquer outras avarias produzidas pelo uso incorreto, a garantia oferecida perde a validade.;WESTERN;0;12;834;2471.9759999999997;3741.324;0;0.356;4.284;4.486;F12860 - 01 - LINYI HAOYI TRADING CP. LTD;XINYUAN ROAD WITH HENGTONG ROAD,TANCHENG INDUSTRY PARK,LINYI CITY,SHANDONG PROVINCE,CHIAN;;7897186095165;;57897186095160;26;20;20;8.6736;32082019;=J7/P7;SEM LI;NCM OK;REPOSIÇÃO
05-03-2026 - 25-608_ESTUDO_250503 - COM LI ANP;05-03-2026 - 25-608_ESTUDO_250503 - COM LI ANP.xlsx;2026-04-02 18:45:43;5264;1;6;WQ010;7008;PC;USD;0.09;=F8*I8;TINTA SPRAY USO GERAL FOSCO BRANCO 400ML Dimensões da Peça: 6,5 x 6,5 x 15,5cm Espessura: Capacidade: Dimensões da Embalagem: N/A Tipo de Embalagem: ETIQUETA ,COLMÉIA Quantidade Inner: N/A Dimensões Inner: x x Quantidade Master: 12 Peças Dimensões Master: 26 x 20 x 20cm Material: Xileno, diclorometano, acetato de etila, ácido 2 propenóico, éter dimetil. Cor: Branco Fosco Marca: WESTERN Origem: CHINA Composição do Produto: 1 unidade Caracteristicas Importantes: • Secagem: 15 minutos ao toque, 1 hora para manuseio e 24 horas para teste de resistência- • Compacto- • Armazenamento menos de 40°C- • Capacidade: 400ml / 250g Instruções de Uso: Preparo da Superfície: • Deve-se limpar bem e lixar (se necessário) qualquer superfície a ser pintada, pois deverá estar seca e completamente livre de gordura, ferrugem, restos de pintura velha, pó, resina, etc. Proteja a parte que não será pintada. Aplicação: • Agite bem a lata antes usar, faça um pequeno teste do aplicador, pressionado a válvula algumas vezes em qualquer superfície, verificando o formato do jato- • Pulverize a uma distância de 10 cm do local, utilizando-se de movimentos uniformes cobrindo a área desejada. Instruções Específicas: • Aplicar de uma a duas demãos, aguarde secagem, lixe com lixa d’água 400 até a superfície ficar homogênea e lisa- • Para uma melhor cobertura, aplique várias demãos com intervalos regulares entre as mesmas- • Em cores metálicas, exceto as cores cromada, ouro e dourada, aplicar duas demãos de verniz. Antes do Uso: Verificar se o produto está em perfeitas condições de uso ou instalação Perigos: N/A Cuidados: Recomendações e Cuidados: • Não aplicar o verniz nas cores metálicas cromada, bronze, ouro e dourada e em superfícies de vinil, isopor, plástico, acrílico ou tecidos emborrachados- • Evite escorrimento, aplicando a primeira demão bem fina, como uma névoa, preparando a superfície para as próximas demãos- • Em plástico, acrílicos, madeira, papel, gesso, metal, couro, cerâmica, vime, fazer um teste em uma pequena área, para verificar a compatibilidade e secagem do produto. OBS.: Em superfície de madeira fazer um pequeno teste antes de aplicar para verificar secagem e resistência, pois ambas poderão ser alteradas- • Não aplicar em temperaturas abaixo de 18°C ou com tempo muito úmido- • Em dias de muito frio, recomenda-se deixar as peças a serem pintadas no sol, antes da pintura- • Não realizar a aplicação em locais fechados ou sem circulação de ar- • Após o uso, limpe a válvula, virando a lata para baixo, e pressionando até sair somente gás- • Em caso de entupimento da válvula, retire o atuador e mergulhe em acetona ou qualquer outro solvente- • Quando necessário, limpe o orifício com uma agulha bem fina. Advertencia/ Atenção: • Manter fora do alcance das crianças- • Trabalhe seguro. Indicação: • Indicada para diversos tipos de pintura, garantindo uma boa cobertura e acabamento, com alto rendimento e excelente secagem, com cores que proporcionam ótimo efeito decorativo. Para todos esses resultados aplique seguindo as instruções de uso. Sac Fornecedor: Sac: 0800 607 1322 - Email: posvendas@etilux.com.br - Site: www.etilux.com.br Garantia: Em condições normais de uso, este produto tem garantia de 90 dias contra defeitos de material e fabricação, mediante apresentação da nota fiscal de compra. Má conservação, manuseio inadequado, quedas ou quaisquer outras avarias produzidas pelo uso incorreto, a garantia oferecida perde a validade.;WESTERN;0;12;584;1730.976;2619.824;0;0.362;4.284;4.486;F12860 - 01 - LINYI HAOYI TRADING CP. LTD;XINYUAN ROAD WITH HENGTONG ROAD,TANCHENG INDUSTRY PARK,LINYI CITY,SHANDONG PROVINCE,CHIAN;;7897186095202;;57897186095207;26;20;20;6.0736;32082019;=J8/P8;SEM LI;NCM OK;REPOSIÇÃO
05-03-2026 - 25-608_ESTUDO_250503 - COM LI ANP;05-03-2026 - 25-608_ESTUDO_250503 - COM LI ANP.xlsx;2026-04-02 18:45:43;5264;1;7;GI-4001;14000;PC;USD;0.08;=F9*I9;GAS PARA MACARICO E FOGAREIRO IMPORTADO 400ML Dimensões da Peça: 6,8 x 6,8 x 19,4cm Espessura: Capacidade: Dimensões da Embalagem: 6,8 x 6,8 x 19,4cm Tipo de Embalagem: ETIQUETA Quantidade Inner: N/A Dimensões Inner: x x Quantidade Master: 28 Peças Dimensões Master: 48 x 28,5 x 21 cm Material: Butano, Propano Cor: Frasco colorido Marca: WESTERN Origem: CHINA Composição do Produto: 1 unidade Caracteristicas Importantes: • Gás Butano e Propano- • Ideal para maçaricos- • 400ml. Instruções de Uso: • Usar este tubo sempre na posição deitada com a parte da válvula aberta virada para cima para evitar vazamento e aproveitar todo o gás do cartucho. Encaixe o bico da válvula no local indicado pelo seu fogareiro. Nunca utilize um fogareiro ao lado de outro. Para maçaricos verificar a compatibilidade do modelo com a válvula da lata e seguir exatamente as instruções do fabricante do maçarico. Antes do Uso: Verificar se o produto está em perfeitas condições de uso ou instalação Perigos: Ao manusear produtos quentes, proteja as suas mãos, Cuidado durante o manuseio do produto para evitar acidentes Cuidados: Precauções: • Aerossol extremamente inflamável. Recipiente pressurizado: pode romper se aquecido. Pode provocar sonolência ou vertigem. Mantenha afastado do calor, faísca, chama aberta ou superfície quentes. Não fume. Não pulverize sobre chama aberta ou outra fonte de ignição. Não perfure ou queime, mesmo após o uso. Mantenha ao abrigo da luz solar. Não exponha a temperatura superior a 50°C. Em caso de inalação: Remova a pessoa para local ventilado e a mantenha em repouso numa posição que não dificulte a respiração. Caso sinta disposição, contate o Disque-Intoxicação ou um médico. Armazene em local bem ventilado. Mantenha o recipiente hermeticamente fechado. • Mantenha fora do alcance das crianças e animais domésticos • Não deixa embalagem de aerossol dentro do veículo/risco de explosão e vazamento. Advertencia/ Atenção: • Nunca inale o gás- • Guardar em local bem ventilado- • Gás liquefeito sob pressão altamente inflamável- • Mantenha longe de fogo ou de fontes de ignição- • Evite deixar exposto ao Sol ou a temperaturas superiores a 50ºC- • Mantenha fora do alcance de crianças- • Não perfure- • Manuseie com cuidado e longe do rosto- • Não amasse e não exponha a pancadas- • Não jogue no fogo, mesmo vazio- • Use somente em áreas bem ventiladas- Indicação: N/A Sac Fornecedor: Sac: 0800 607 1322 - Email: posvendas@etilux.com.br - Site: www.etilux.com.br Garantia: Em condições normais de uso, este produto tem garantia de 90 dias contra defeitos de material e fabricação, mediante apresentação da nota fiscal de compra. Má conservação, manuseio inadequado, quedas ou quaisquer outras avarias produzidas pelo uso incorreto, a garantia oferecida perde a validade.;WESTERN;0;28;500;2939.6325459317586;4743;0;0.324;9.016;9.486;F12860 - 01 - LINYI HAOYI TRADING CP. LTD;XINYUAN ROAD WITH HENGTONG ROAD,TANCHENG INDUSTRY PARK,LINYI CITY,SHANDONG PROVINCE,CHIAN;;7897186095066;;57897186095061;48;28.5;21;14.364;27111300;=J9/P9;COM LI - ANP;NOVO;SUGESTÃO
